author,body,score,created_utc,preprocessed_body,sentiment
Imadeapromisemrfrodo,"Give me a disk drive and it’s a day one purchase. Otherwise I’ll just wait till they launch a version with one….got too many physical games to switch to all digital.

And I even looked into buying an extra disk drive but they’re all sold out, so yeah GG…",0,1727646658.0,give disk drive day one purchase otherwise ill wait till launch version onegot many physical games switch digital even looked buying extra disk drive theyre sold yeah gg,positive
Morguard,If it came with a disk drive I would have probably bought one.,0,1727646856.0,came disk drive would probably bought one,neutral
killthegeezer,It’s still available in France too,0,1727646990.0,still available france,positive
antftwx,"I just don't understand why they couldn't have given us OG early adopters a final send off with some 30th plates for the fat model. I have no interest in the Pro and, while I wouldn't mind owning a slim, it just seems like a big middle finger to those of us who have been supporting this gen from the get go.",0,1727647082.0,dont understand couldnt given us og early adopters final send th plates fat model interest pro wouldnt mind owning slim seems like big middle finger us supporting gen get go,positive
chazmann,"""Dont worry guys. The 5th HD remaster of this game is going to have proper ray tracing and run at 40fps! Look, you can see real reflections in the windows and puddles!""

I'd rather pay my rent lol.",0,1727647107.0,dont worry guys th hd remaster game going proper ray tracing run fps look see real reflections windows puddles id rather pay rent lol,positive
superleaf444,"L
O
L

Won’t sell then either",0,1727647134.0,l l wont sell either,neutral
Asimb0mb,"They had me on board until they announced the price. When I realized I had to pay €520 to upgrade from my PS5 (by selling it for €400), it just made no sense to upgrade now. Better to just wait four more years and get the PS6 instead. It will have everything the PS5 Pro has, but be even better.

For me a better deal would have been to release it with a 1TB SSD and actually give it a reasonable price. Something like $630/€700 with a disc drive instead of freaking $780/€920. They're insane for thinking that's even remotely acceptable.",0,1727647150.0,board announced price realized pay upgrade ps selling made sense upgrade better wait four years get ps instead everything ps pro even better better deal would release tb ssd actually give reasonable price something like disc drive instead freaking theyre insane thinking thats even remotely acceptable,positive
LuckyTheBear,"Make a PS5 game that makes me go ""This game would be massively better if my console had more power""

When I bought my One X it was for HDR and 4k steaming. PS4 got HDR for free, but at least the PS4 Pro was a tangible improvement to performance.

If you're a parent, and you wanna buy your kids video games, do you but a PS5 Pro for $700, a PS5 for $500 or a series S for $300? 

With the direction the economy is going, they should be making cheaper consoles not more expensive ones. That $999 PS5 30th anniversary addition is very concerning if it's any indication as to what Sony thinks consumers are willing to pay.",0,1727647225.0,make ps game makes go game would massively better console power bought one x hdr k steaming ps got hdr free least ps pro tangible improvement performance youre parent wanna buy kids video games ps pro ps series direction economy going making cheaper consoles expensive ones ps th anniversary addition concerning indication sony thinks consumers willing pay,neutral
TheClownIsReady,The PS5 PRO is gonna sell a ton of PS5 Slims this holiday season.,0,1727647296.0,ps pro gonna sell ton ps slims holiday season,neutral
Sventhetidar,I was iffy on it. The only reason it was a snap buy for me is because I was able to get the anniversary bundle.,0,1727647315.0,iffy reason snap buy able get anniversary bundle,positive
NoMansWarmApplePie,"Most of it is scalpers.

Alot of ""sheep"" buyers sometimes think, oh man, hard to find that means I have to buy it as soon as it's available when it's scalpers this time artificially driving demand up.

Before, it was a combination of both legitimate high level demand and scalpers driving it up further.",0,1727647398.0,scalpers alot sheep buyers sometimes think oh man hard find means buy soon available scalpers time artificially driving demand combination legitimate high level demand scalpers driving,positive
needaburnerbaby,Most Canadian retailers sold out. But that’s probably mostly resellers that will hopefully get f’d in the a.,0,1727647430.0,canadian retailers sold thats probably mostly resellers hopefully get fd,positive
Atmp,"I’ll get one if it’s available when it comes out, if there’s a decent trade in deal to upgrade from the original ps5 at GameStop",0,1727647568.0,ill get one available comes theres decent trade deal upgrade original ps gamestop,positive
ConclusionDifficult,"Really, who wants it apart from a few pc gamers?",0,1727647611.0,really wants apart pc gamers,positive
tronx69,"I want to get it during Christmas, I think as a mid gen refresher is worth it specially if you play primarily on the PS5",0,1727647626.0,want get christmas think mid gen refresher worth specially play primarily ps,positive
AdmiralLubDub,"Pros never sell well, they aren’t really made for the mass market and more for enthusiasts.",0,1727647746.0,pros never sell well arent really made mass market enthusiasts,positive
mattman0000,$600 by Christmas,0,1727647826.0,christmas,neutral
Breadflat17,"I'll only buy one if it's required for Ghost of Yohei to run at 60fps.  Until then, I'm sitting this one out.",0,1727648326.0,ill buy one required ghost yohei run fps im sitting one,neutral
No-Standard-4326,"Tbh I think it would have been a perfect console for me. The blurriness of performance I find it annoying. but 700$ is really really steep, considering the cpu is not even changed to something better. Like for 50% more of price, it’s not that annoying. And considering in 4 years the PS6 is likely going to be here, the trade in is likely going to be similar so I don’t see the reason. Honestly the disc drive i don’t even care, but the 1$ plastic stand that’s sold 30$, not included, it’s like an insult yeah. Maybe I’ll get it when it’s 200$ off.",0,1727649035.0,tbh think would perfect console blurriness performance find annoying really really steep considering cpu even changed something better like price annoying considering years ps likely going trade likely going similar dont see reason honestly disc drive dont even care plastic stand thats sold included like insult yeah maybe ill get,positive
MrGamePadMan,My base PS5 will do me just fine until PS6. 🙂,0,1727649291.0,base ps fine ps,negative
kpeds45,"I'm not shocked. Didn't they have to stop producing more PSVR2 units because they never sold out the first production? It's the same thing, people don't want to spend this much on a console. I'm in Canada, it's $995. I have a job, can afford that. I would not ever buy it.",0,1727649956.0,im shocked didnt stop producing psvr units never sold first production thing people dont want spend much console im canada job afford would ever buy,positive
Bhattman93,Serves the scalpers and Sony right. Totally botched the price point.,0,1727651348.0,serves scalpers sony right totally botched price point,positive
SpyroManiac36,And the PS5 Pro will outsell the xbox series consoles combined lol,0,1727652716.0,ps pro outsell xbox series consoles combined lol,positive
WarningBackground442,tom warren ps 5 pro is coming out november 7 2024 holiday 2024 november 2024,0,1727654043.0,tom warren ps pro coming november holiday november,neutral
Kidtendo,"Haha, I love it for the scalpers haha",0,1727655320.0,haha love scalpers haha,positive
Relevant-Snow-4676,"If I was sony, I'd keep my 30th anniversary edition resources on backup just in case sales don't perform up to expectations and clear the stock via it. The design simply made a difference in desirability",0,1727655883.0,sony id keep th anniversary edition resources backup case sales dont perform expectations clear stock via design simply made difference desirability,positive
TacoCatSupreme1,The performance difference is too minimal,0,1727656124.0,performance difference minimal,negative
giomaxios,"Yeah, I didn't even get a PS5. Gaming was already expensive over here, now it is PROHIBITIVE. No chance, mano.

Best I can do is get a very good PC and just start playing everything I can on it. I will emulate and pirate what I can as we all do over here when shit like this happens.",0,1727656971.0,yeah didnt even get ps gaming already expensive prohibitive chance mano best get good pc start playing everything emulate pirate shit like happens,positive
roll_in_ze_throwaway,"Really?  *That's * how you're trying to spin this?


What are you gonna tell your shareholders when Q1 of 2025 comes around and half of your $700 boxes are still in warehouses because the choice was either groceries and rent for the month or a refresh of a console that isn't gonna run games any better?",0,1727666193.0,really thats youre trying spin gonna tell shareholders q comes around half boxes still warehouses choice either groceries rent month refresh console isnt gonna run games better,positive
whitehusky,"I got one to upgrade my PS5. Look, gaming a fun hobby. The next console won’t be it for, what, 4 years? Maybe 5? If it’s 4, $700/4=$175 per year. I get that much enjoyment out of it each year for sure. That’s like 2 or 3 nicer dinners out.",0,1727667209.0,got one upgrade ps look gaming fun hobby next console wont years maybe per year get much enjoyment year sure thats like nicer dinners,positive
myNam3isWHO,I hope demand is low and scalpers/$ony lose a ton of money,0,1727667411.0,hope demand low scalpersony lose ton money,neutral
nolesfan2011,"I don't even really like the current PS5, I really don't see what the market for this is compared to high end gaming PCs",0,1727669742.0,dont even really like current ps really dont see market compared high end gaming pcs,positive
DeskLaser,It's not really supposed to sell out. It's a niche product aimed at a very small audience. It's there for the people with the equipment necessary for it. It's not for the general audience.,0,1727674478.0,really supposed sell niche product aimed small audience people equipment necessary general audience,negative
unfluxa,"Made the decision and just pre-ordered mine today, can't wait for it to come and start getting the extra benefits. My causal gaming hobby life is good.",0,1727678922.0,made decision preordered mine today cant wait come start getting extra benefits causal gaming hobby life good,positive
InnerStrength4kids,"There's hardly any pure ps5 exclusives. 

Why would we pay 700 dollars to play games that were on ps4 or will release on ps4?

The ps5 hasn't even been utilised fully",0,1727680327.0,theres hardly pure ps exclusives would pay dollars play games ps release ps ps hasnt even utilised fully,negative
entrydenied,They should send some here....,0,1727681108.0,send,neutral
alpha7158,"Of course they haven't, they are only available for preorder. Or at least I think so?

I'll probably get one but I can't see it for purchase on the UK Amazon because it's not out yet.",0,1727697477.0,course havent available preorder least think ill probably get one cant see purchase uk amazon yet,positive
WrongKindaGrowth,Available for what?,0,1727698626.0,available,positive
ThePrinceMagus,"I got mine! 

But seriously, we're supposed to look at Sony correctly judging the amount of these they needed to make for their customer base as some sort of... win for the people mad about the price?",0,1727705271.0,got mine seriously supposed look sony correctly judging amount needed make customer base sort win people mad price,negative
OptiKnob,"700 dollars for 150 dollars worth of hardware and 50 dollars worth of programming.

Quite the deal.

Oh, and 500 dollars worth of hype.",0,1727708312.0,dollars dollars worth hardware dollars worth programming quite deal oh dollars worth hype,positive
saw_wave_dave,"If Sony wants it to sell out, they need to make more games that showcase what it can do.",0,1727708620.0,sony wants sell need make games showcase,positive
javiergame4,Just have no reason to upgrade. No new games,0,1727712604.0,reason upgrade new games,negative
Automatic_Bit4948,"Why would they sell out. It makes more sense to sell your  current ps5 and build a pc. 


I'm sure the 4080s or 4070s will be on sale soon.  


 That or just keep your current ps5 and enjoy the same games there. ",0,1727717266.0,would sell makes sense sell current ps build pc im sure sale soon keep current ps enjoy games,positive
ishsreddit,"The market will adjust the price of the PS5 Pro to what it should be pretty quickly if it doesn't sell. If sales are very low into the Holidays, it will drop to $600 in no time as spending comes to a crawl after Holidays.",0,1727717374.0,market adjust price ps pro pretty quickly doesnt sell sales low holidays drop time spending comes crawl holidays,positive
Tentacled-Tadpole,You love to see it,0,1727729526.0,love see,positive
turbo_fried_chicken,What do you need this for if you have a PS5? It's been out for a long time now.,0,1727730819.0,need ps long time,negative
Acceptable_Log425,I think it’s because no one really cares about the console,0,1727741263.0,think one really cares console,positive
PostNutt_Clarity,I'll wait till they come to their senses and offer it with a disk drive.,0,1727747726.0,ill wait till come senses offer disk drive,neutral
RAH7719,No optical drive = no thankyou!!!,0,1727762601.0,optical drive thankyou,neutral
Working_Job_7129,"For that price, it can stay available until it goes on sale. Fuck Sony's policies and their exploitive greed.",0,1727769867.0,price stay available goes sale fuck sonys policies exploitive greed,neutral
Working_Job_7129,"For that price, it can stay available until it goes on sale. Fuck Sony's policies and their exploitive greed.",0,1727769878.0,price stay available goes sale fuck sonys policies exploitive greed,neutral
Working_Job_7129,"For that price, it can stay available until it goes on sale. Fuck Sony's policies and their exploitive greed.",0,1727769878.0,price stay available goes sale fuck sonys policies exploitive greed,neutral
Shellman00,All the hype is around the 30th anniversary editions. The base PS5 Pro is gonna sell like dogwater.,-8,1727643812.0,hype around th anniversary editions base ps pro gonna sell like dogwater,negative
DinosaurAlert,"All these “PS5 pro isn’t worth it!“ arguments are completely valid, but also completely wrong.  A 4080 isn’t worth the price increase over the 4070 (or pick any other example), but people like them.

The pricing is due to no competition from Microsoft, who seem unable to just want to make a console. Last gen it was Kinect and TV, this gen it is wanting to be Netflix for gaming.",-1,1727646459.0,ps pro isnt worth arguments completely valid also completely wrong isnt worth price increase pick example people like pricing due competition microsoft seem unable want make console last gen kinect tv gen wanting netflix gaming,negative
mandysux,Does this pro console have a 2.5gb Ethernet ? Cause which pro wants bloody WiFi 7????!,-1,1727648482.0,pro console gb ethernet cause pro wants bloody wifi,negative
ColbyAndrew,Time for a layoff.,-1,1727723743.0,time layoff,neutral
HG21Reaper,The PS5 Pro is so unnecessary and its not a joke.,-1,1727744174.0,ps pro unnecessary joke,negative
lavalakes12,Performance mode was/is good enough. The fidelity mode wasn't worth it to me.   Upgrading to pro to give me something I'm already comfortable doesn't seem worth it to me ,-2,1727645850.0,performance mode wasis good enough fidelity mode wasnt worth upgrading pro give something im already comfortable doesnt seem worth,positive
g_dude3469,Why would *anyone* buy this bullshit at this price? Such a waste of money when you could just get an original.,-2,1727708580.0,would anyone buy bullshit price waste money could get original,positive
AntiWesternIdeology,"As a scalper who scalped Xboxs and PS5s around the flu of 2020, I’m just simply not interested in scalping any longer.",-2,1727720564.0,scalper scalped xboxs pss around flu im simply interested scalping longer,negative
RandoDude124,Damn those scalpers are gonna be shitting bricks.,887,1727645950.0,damn scalpers gonna shitting bricks,neutral
Gnarmando86,"Those ebay prices are crazy

https://preview.redd.it/tk07lu7fvtrd1.png?width=806&format=pjpg&auto=webp&s=a6866a9db76676cbe17ebfca8ada0fe0af8b6b16",59,1727650276.0,ebay prices crazy httpspreviewreddittklufvtrdpngwidthformatpjpgautowebpsaadbcbeebfcaadafeafbb,negative
None,[deleted],66,1727646754.0,deleted,neutral
IfYouGotALonelyHeart,All they have to do is cancel their own orders. Scalpers are at no loss here.,89,1727645866.0,cancel orders scalpers loss,positive
Stoibs,"Wait really? I know the 30th Anniversary edition was being scalped but I didn't think they were trying this with the regular pro's also.

I'm in neither the US or the UK but yeah local shops here never stopped selling them since they went up. I could even get it for about half price if I trade in my current PS5+4 games with a promo they are holding but I still don't really see the value or want one :/",32,1727645979.0,wait really know th anniversary edition scalped didnt think trying regular pros also im neither us uk yeah local shops never stopped selling since went could even get half price trade current ps games promo holding still dont really see value want one,negative
LOLerskateJones,"I was sure the scalpers were gonna lose on this, and I was right. 

I figured it would sell out eventually but be nowhere near as in demand as launch PS5’s, guess I was only half right 

I happily pre-ordered, looking forward to it, and I’m glad the people who want one can find one",20,1727645993.0,sure scalpers gonna lose right figured would sell eventually nowhere near demand launch pss guess half right happily preordered looking forward im glad people want one find one,positive
Ghillie007,"Have you seen the Anniversary editions? There’s bids tossed at them for 4,000. I haven’t looked since a few days ago",2,1727652411.0,seen anniversary editions theres bids tossed havent looked since days ago,negative
duzra,"Just looked on eBay uk. Scalpers have them up for £1000+ God, I hope these scum bags lose a fortune on this.",1,1727653982.0,looked ebay uk scalpers god hope scum bags lose fortune,negative
ExtremeWild5878,"Yep, I hope these scalpers loose out on thousands of dollars when no one buys their shit. When the original PS5 dropped, it was because of these ass hats that they weren't available at the store or online. So yeah I hope they loose out big time with the PS5 Pro.",1,1727657432.0,yep hope scalpers loose thousands dollars one buys shit original ps dropped ass hats werent available store online yeah hope loose big time ps pro,positive
Ganyu1990,At $700 im looking at just buying a pc. $500 is the limit to what im willing to spend on a console. Sony realy needed to lower the price of the base ps5 and put the pro out at $500. $700 is just to mich for what it offers.,1,1727658775.0,im looking buying pc limit im willing spend console sony realy needed lower price base ps put pro mich offers,negative
TheClassicAudience,"I was thinking this as well. There are a ton left... after every idiot scalper bought at least a dozen or a couple dozen to ""resell"".

I honestly love the idea of them having to sell for under the cost of it just to recoup some money because the market is flooded and nobody will be buying a ""new Pro without a warranty for more money than it would cost at amazon with an amazing warranty"".",1,1727659150.0,thinking well ton left every idiot scalper bought least dozen couple dozen resell honestly love idea sell cost recoup money market flooded nobody buying new pro without warranty money would cost amazon amazing warranty,positive
Hopeful_Swan_4011,30th anniversary ones though are silly,1,1727660846.0,th anniversary ones though silly,negative
Kuting08,These scums should rot in hell.,1,1727671513.0,scums rot hell,neutral
dimspace,They had them priced at £4500 on the first day here,1,1727689013.0,priced first day,positive
Schnauser,"Once supply dries up, these will be bought by someone.",1,1727690829.0,supply dries bought someone,neutral
ShiftSandShot,"Honestly, the PS5 sounds like fun...

But I am just getting so much mileage out of my PS4, still, and the price tag for the base PS5 with disc drive is a bit much to justify.",1,1727701884.0,honestly ps sounds like fun getting much mileage ps still price tag base ps disc drive bit much justify,positive
Negativety101,"Any time Scalpers suffer, I smile.",1,1727702023.0,time scalpers suffer smile,positive
Party-Benefit-3995,"$700 is scalpers pricing.  Sony is beating out the competition, who the fuck buys a $1k console that cant do excel?",1,1727705696.0,scalpers pricing sony beating competition fuck buys k console cant excel,negative
ovondalini,"Yeah seriously, not to mention the anniversary edition going for $3k-$10k resell. They’re going to be EXTREMELY disappointed and upset when they realize no one is dumb enough nor interested in buying shit at that price.",1,1727706467.0,yeah seriously mention anniversary edition going kk resell theyre going extremely disappointed upset realize one dumb enough interested buying shit price,negative
BoboCookiemonster,Ok I love shitting on the release price but if it gets cheaper before Christmas and that was just to fuck with scalpers I’m gonna laugh so hard.,1,1727709032.0,ok love shitting release price gets cheaper christmas fuck scalpers im gonna laugh hard,positive
Wrx_me,"Which I find funny because when the PS5 and series X came out, they were also selling for $800-1000",1,1727709072.0,find funny ps series x came also selling,positive
ExtendedSpikeProtein,I actually ordered one this weekend.,1,1727709977.0,actually ordered one weekend,neutral
DL_Omega,The PSX anniversary one is the only one that will be worth anything.,1,1727715567.0,psx anniversary one one worth anything,positive
EthanFreeman27,"This is great. I just wished Sony would have released enough of the 30th anniversary ones to meet the day one demand. You have 24 hours to get one. Might not ship for a little while but you’ll get it. Bump the price up a little. That way everyone who really wants one gets it, you make a little more money and scalpers don’t get shit.",1,1727719056.0,great wished sony would released enough th anniversary ones meet day one demand hours get one might ship little youll get bump price little way everyone really wants one gets make little money scalpers dont get shit,positive
SquishyTacoEars,"When the original price is deterring people from buying it, it's insane that these scalpers think anyone will be willing to buy it for any more than that lol",1,1727724984.0,original price deterring people buying insane scalpers think anyone willing buy lol,positive
Johnny_Menace,"To deter scalping, retailers should remove return policies on limited stuff.",1,1727730103.0,deter scalping retailers remove return policies limited stuff,negative
Ok_Rub6575,This makes me glad. I ordered one but still scalpers need to burn,1,1727732944.0,makes glad ordered one still scalpers need burn,positive
Tyflowshun,Someone with money will buy them because they think they will be too hot of a commodity when no one wants them for that price. Gonna be seeing a bundle of timtoks of people who got their $1300 PS5 and how they ~~don't have any games to play yet~~ are playing NBA2K27 on some ps4 graphics.,1,1727735057.0,someone money buy think hot commodity one wants price gonna seeing bundle timtoks people got ps dont games play yet playing nbak ps graphics,positive
LunarRhapsody,Got curious ans checked eBay. 1750 Euros for a PS5 Pro...,1,1727740103.0,got curious ans checked ebay euros ps pro,negative
monkeyninja6969,I hope somewhere out there are still scalpers with about 50 PS5's at their house they couldn't profit hate they can't get rid of.,1,1727752566.0,hope somewhere still scalpers pss house couldnt profit hate cant get rid,negative
gatoperro805,"You and me both!
And like 2 million other people who don’t rip off others!!!!
🤣😂🤣🤣😂🤣👍👍👍👍👍",1,1727770806.0,like million people dont rip others,negative
TemperatureSure2397,"Sony isn't going to sell a lot of these. Scalpers are going to lose money big time either way. Because these are going to be readily available, why go through them? And if it wasn't, who is buying them anyway. The Pro is a waste of money. It's not a significant upgrade for it to cost that much.",1,1727806046.0,sony isnt going sell lot scalpers going lose money big time either way going readily available go wasnt buying anyway pro waste money significant upgrade cost much,positive
Carinx,Scalpers selling products not even released and people buying them from Scalpers to me are both dumb.,1,1727962903.0,scalpers selling products even released people buying scalpers dumb,negative
DefiantSecurity3674,Those may be the ps1 edition not the regular.,1,1727968268.0,may ps edition regular,neutral
Rashlyn1284,"Man, if that was AUD it'd almost be cheaper than our retail price of $1199 :(",1,1727647295.0,man aud itd almost cheaper retail price,negative
TheButteredBiscuit,What’s crazy is how scalpers are marking up the disk drives and you can literally go on any major website and get them. They’re on a different planet fr,0,1727648156.0,whats crazy scalpers marking disk drives literally go major website get theyre different planet fr,negative
