author,body,score,created_utc,preprocessed_body,sentiment
Neonlad,What’s actually hilarious is there are a bunch of scalpers selling these on EBay right now for like $1000 or even $1300. Love to see those rot on eBay when I could pop over to PS Direct and buy one if I ever cared.,3170,1727644401.0,whats actually hilarious bunch scalpers selling ebay right like even love see rot ebay could pop ps direct buy one ever cared,positive
syrupgreat-,"They should have just had 30th Anniversary variant widely available, it would’ve sold way better",568,1727654045.0,th anniversary variant widely available wouldve sold way better,positive
RelThanram,The lack of a disc drive was a big sticking point for me. You can’t imply that it’s the definitive version of the console if you’re taking stuff away from it.,2281,1727644079.0,lack disc drive big sticking point cant imply definitive version console youre taking stuff away,neutral
Dontrip408,If the PS4 Pro didn’t sell out what makes people think the Ps5 Pro was going to sell out??,727,1727643992.0,ps pro didnt sell makes people think ps pro going sell,neutral
tunafun,They should have made more retro editions,272,1727644694.0,made retro editions,positive
Fit_Rice_3485,"The PS4 pro didn’t sell out either

This will end up being 10-13% of the entire PS5 install base. Just like PS4 pro",387,1727644003.0,ps pro didnt sell either end entire ps install base like ps pro,negative
shootamcg,"I don’t recall the PS4 Pro selling out, I just walked into Best Buy and bought one the day it came out.",175,1727644229.0,dont recall ps pro selling walked best buy bought one day came,positive
Loyal_Darkmoon,"The lack of a disc drive and the european price is a no-go for me.

If you wanna buy a PS5 Pro in Europe plus disc drive, that is about 1016$ (920€), which is even more insane than the US price (780$).",15,1727674598.0,lack disc drive european price nogo wanna buy ps pro europe plus disc drive even insane us price,negative
santathe1,We are out of the Covid situation that caused the chip crunch. Why would anything completely sell out any more?,12,1727647723.0,covid situation caused chip crunch would anything completely sell,positive
josh_bourne,So now when something is available to buy it means didn't sell well?!,222,1727645100.0,something available buy means didnt sell well,positive
Biobooster_40k,"I will tell ya, Sony needs to sell those anniversary plates for the Ps5. Those would definitely be sold out.",18,1727649541.0,tell ya sony needs sell anniversary plates ps would definitely sold,neutral
Low-Way557,PS4 Pro was easy to get too. This isn’t really surprising.,39,1727645282.0,ps pro easy get isnt really surprising,positive
Xeccess,"I don't think the Pro was meant to be sold out, they'll be making this thing until the PS6 releases, it's not just a limited time thing",93,1727644004.0,dont think pro meant sold theyll making thing ps releases limited time thing,negative
thesuspicious24,"I’m finally at a point in my life where I could easily spend money on this and not blink an eye. I have the time, the money, but no interest whatsoever",39,1727651906.0,im finally point life could easily spend money blink eye time money interest whatsoever,positive
BAWAHOG,When did “hasn’t sold out” become a failure?,84,1727644625.0,hasnt sold become failure,negative
MRintheKEYS,"I’ll get one when they are in store.  I’ll trade in my PS5 disc for the new one.  But I’m in no rush to do it. 

Sony is adhering too close to the “this is what we do every generation” playbook on this.  The pandemic and supply shortages really messed with this generations lifespans.",32,1727644425.0,ill get one store ill trade ps disc new one im rush sony adhering close every generation playbook pandemic supply shortages really messed generations lifespans,positive
TheRed24,"Never was going to sell out straight away, PS4 Pro didn't sell out straight away either for the same reason, people are still missing the market of the console, it's a niche market. The fact it hasn't sold out yet is a good thing because it means they made enough available for the people that wanted it to make sure they got one, which is great, hopefully it's something they'll be able to also do with the next base model (PS6).

The PS5 struggled to fulfill demand largely due to the pandemic, this is what gave Scalpers such a cornered market because it was so limited, this will hopefully never happen again to such an extent.",6,1727647380.0,never going sell straight away ps pro didnt sell straight away either reason people still missing market console niche market fact hasnt sold yet good thing means made enough available people wanted make sure got one great hopefully something theyll able also next base model ps ps struggled fulfill demand largely due pandemic gave scalpers cornered market limited hopefully never happen extent,positive
LostAlbertan,people want the anniversary one,15,1727644369.0,people want anniversary one,neutral
Brookie069,"It’s not a big enough upgrade to be worth it over the normal PS5 and this generation is hamstrung by the awful Series S, Devs are even admitting it’s causing them headaches.",16,1727653810.0,big enough upgrade worth normal ps generation hamstrung awful series devs even admitting causing headaches,negative
Empty-Lavishness-250,"That thing costs 850€ (\~948$) here, no wonder...",15,1727664860.0,thing costs wonder,neutral
VariousBread3730,Unpopular opinion: it’s only $100 too expensive,25,1727653780.0,unpopular opinion expensive,negative
FudgingEgo,"Why do people expect it to sell out? 

If people wanted a PS5, they’d have one by now.

Only the enthusiast’s are going to get a pro.

The average person isn’t upgrading.",28,1727644965.0,people expect sell people wanted ps theyd one enthusiasts going get pro average person isnt upgrading,negative
FRIENDSHIP_BONER,"I would buy one if I could afford it. For those that can afford it easily, it looks worth it, but the base PS5 is great so I don’t feel like I’m missing out.",5,1727649532.0,would buy one could afford afford easily looks worth base ps great dont feel like im missing,positive
KiraOnElmStreet,"If you already have a ps5, its not really worth upgrading that much.... its like upgrading from an iPhone 16 to an iPhone 16pro...",4,1727671742.0,already ps really worth upgrading much like upgrading iphone iphone pro,positive
InevitableBlue,Why would the PS5 Pro sell out like that. It’s not that different than the ps5 design so it shouldn’t be hard to make. I do expect less sells than the ps4 pro but not by that much.,8,1727647238.0,would ps pro sell like different ps design shouldnt hard make expect less sells ps pro much,negative
globs-of-yeti-cum,No disc drive=no buy,9,1727657461.0,disc driveno buy,neutral
Money_Tough,Really... might sell my ps5 slim to get this with my c4 oled,50,1727643887.0,really might sell ps slim get c oled,positive
Wahjahbvious,"I didn't buy the PS4 Pro until it went on sale for $399. I'm a buyer for this one at $499, but no higher.",8,1727652107.0,didnt buy ps pro went sale im buyer one higher,negative
Hopeful-Antelope-684,Let’s keep bullying them into lowering the price,5,1727672377.0,lets keep bullying lowering price,neutral
CrimsonGear80,Was it supposed to sell out?,18,1727644255.0,supposed sell,neutral
rejectallgoats,Or they just made enough this time.,20,1727644603.0,made enough time,neutral
D0nCoyote,I will not buy another PlayStation console as long as my OG PS5 continues to run as smoothly as it did day 1. Hit me up when the 6 drops.,6,1727705719.0,buy another playstation console long og ps continues run smoothly day hit drops,positive
PornCommentsAreWeird,"Concern trolling by a very pro-Microsoft ""journalist.""  Hardware shortages are the exception, not the rule, and for everyone other than Nintendo (who seemingly do it on purpose) the exception has only been during a global pandemic.  

Is the Pro selling well?  Selling what they hoped?  Selling worse than projected? I have no idea and no one else other than people high up at Sony do either. This is just warren feeding the trolls who love console war BS. I have and enjoy my xbox and gamepass, but there are certainly some xbox leaning journalists who are annoying, and I put warren on that list, even though he does some good reporting at times as well.",21,1727644854.0,concern trolling promicrosoft journalist hardware shortages exception rule everyone nintendo seemingly purpose exception global pandemic pro selling well selling hoped selling worse projected idea one else people high sony either warren feeding trolls love console war bs enjoy xbox gamepass certainly xbox leaning journalists annoying put warren list even though good reporting times well,positive
Gator1508,I have like 50 physical games between ps4 and 5.  Why the fuck would I buy this?  ,13,1727654926.0,like physical games ps fuck would buy,negative
nuevatemporada1,"It’s feels like slowly but surely, everything will be bound to services, and subscription costs will ultimately become the difference between having access to a library of games to play vs. having nothing.

More and more we will become a generation of renters who own nothing but the privilege to continue paying for access.",6,1727646078.0,feels like slowly surely everything bound services subscription costs ultimately become difference access library games play vs nothing become generation renters nothing privilege continue paying access,positive
PharoahZCurse,Cost of living crisis. Everyone’s going into debt.,5,1727646354.0,cost living crisis everyones going debt,neutral
Gizmo16868,It really wasn’t meant to sell out. The PS4 Pro never did. It’s mean to be an additional console available for those who want it.,23,1727644374.0,really wasnt meant sell ps pro never mean additional console available want,positive
Icy-Lab-2016,"This was never going to sell out. Its a mid gen refresh and its very expensive. The much cheaper PS4 pro didn't sell out either (I don't think the Xbox One X did either). Mid gen refreshes are not as popular as a completely new gen. The pandemic shortages were unique, even the Switch sold out, and that was out for years at that point.

I am sure the PS6, Switch 2 and new Xbox will sell out initially, but I don't think we are going to see the same shortages as during the covid.",3,1727645339.0,never going sell mid gen refresh expensive much cheaper ps pro didnt sell either dont think xbox one x either mid gen refreshes popular completely new gen pandemic shortages unique even switch sold years point sure ps switch new xbox sell initially dont think going see shortages covid,positive
fightnight14,I thought that releasing the limited anniversary edition saved the regular PS5 Pro's stock because most scalpers aimed for those. They should do this on every new console release.,3,1727648335.0,thought releasing limited anniversary edition saved regular ps pros stock scalpers aimed every new console release,positive
Adventurous-Love9997,They should of just made the pro in retro and added in the disc drive.  I'd gladly pay $700 for this.  As it is I'm good with my original ps5 that included the drive.,3,1727649361.0,made pro retro added disc drive id gladly pay im good original ps included drive,positive
NASA876,"More than likely, the PS6  will come with a detachable disc drive as well.",3,1727649585.0,likely ps come detachable disc drive well,positive
heebs387,People act like this is supposed to generate the same level of interest as a numbered Playstation. This is very much a niche product for a specific set of PlayStation people.,3,1727653154.0,people act like supposed generate level interest numbered playstation much niche product specific set playstation people,positive
MembershipSolid7151,"No way was I dropping $800 on a no stand, no disc drive console when I just purchased my PS5 1.5 years ago. I’ll wait for the PS6. Looking forward to GTA6 on my PS5.",3,1727654993.0,way dropping stand disc drive console purchased ps years ago ill wait ps looking forward gta ps,neutral
gotkube,Narrator: “It wasn’t…”,3,1727656289.0,narrator wasnt,neutral
Unhappy_Ad_227,"If we had games actually worth upgrading I’d buy one, it’s not the price deterring me.  It’s lack of games.",3,1727663083.0,games actually worth upgrading id buy one price deterring lack games,positive
KhetyNebou,"If PS6 doesn’t read ps5 and ps4 disc, i will maybe get a ps5 pro and put a disc drive on,",3,1727663838.0,ps doesnt read ps ps disc maybe get ps pro put disc drive,neutral
Zeal514,"Looks like Sony is finding out that just cause manufacturing prices increased, doesn't mean the workers wages have increased.  700 to your typical American is like 700 back in 2018.  Its even worse cause our daily costs, like food, energy, interest, etc has gone up with inflation.   We are now at the point where ppl simply cannot afford the prices.",3,1727667172.0,looks like sony finding cause manufacturing prices increased doesnt mean workers wages increased typical american like back even worse cause daily costs like food energy interest etc gone inflation point ppl simply cannot afford prices,negative
ArcticBeast3,This is great news. Thats how it should be. You want one you can get one.,3,1727673651.0,great news thats want one get one,positive
retrovideogamer2000,People complained about the price but will pay 3500-4000 for the 30th anniversary edition.,3,1727680267.0,people complained price pay th anniversary edition,negative
anynonus,I'm switching to PC gaming,3,1727692030.0,im switching pc gaming,neutral
Drd4all,"They can take their ""PRO"" digital only version and well as the heritage digital only version and shove them up their a**",3,1727692036.0,take pro digital version well heritage digital version shove,neutral
AlteisenX,"Isnt it because everyone who wanted one wanted the cool exclusive version and then said ""I dont want second place"" AKA the regular one? 

They kind of shot themselves in the foot. People would lose interest after not getting the ""cool"" one.",3,1727697406.0,isnt everyone wanted one wanted cool exclusive version said dont want second place aka regular one kind shot foot people would lose interest getting cool one,positive
EnServe31,PS4 pro was easy to obtain too but I guess it’s all about narratives.,3,1727713563.0,ps pro easy obtain guess narratives,positive
CitronOptimal,Im glad consumers are standing up to this. It’s pure greed.,3,1727724565.0,im glad consumers standing pure greed,positive
Any-Secret-134,"Just remember the Emotion Engine chip and what happened to get the price lower, you get what you pay for.",3,1727792439.0,remember emotion engine chip happened get price lower get pay,neutral
Esham,"Lol. 

If it sold out its due to terrible manufacturing.

If it doesn't sell out its poor sales. 

Shills be shills",25,1727644494.0,lol sold due terrible manufacturing doesnt sell poor sales shills shills,negative
xiofar,"Compared to PC prices, it is a good deal. 

Compared to food and rent, it’s too high for most.",9,1727644801.0,compared pc prices good deal compared food rent high,positive
Livio88,lol even the scalpers thought it was overpriced,35,1727643799.0,lol even scalpers thought overpriced,positive
HIGHonLIFE1012,"The PS4 Pro didn't sell out at launch so the expectations were pretty much set that the PS5 Pro wouldn't either. Anybody taking this as a ""win"" or ""told you so"" moment are going to look pretty dumb when they report the numbers for the amount sold and it being a success based on expectations. Also, you know Tom Warren is secretly fuming that Xbox ain't done nothing for the past few months so gotta stay farming that engagement and feed the trolls by pointing out the obvious.",5,1727655039.0,ps pro didnt sell launch expectations pretty much set ps pro wouldnt either anybody taking win told moment going look pretty dumb report numbers amount sold success based expectations also know tom warren secretly fuming xbox aint done nothing past months gotta stay farming engagement feed trolls pointing obvious,positive
Aranthos-Faroth,"I’m waiting for:
1. Price drop.
2. Disk drive incl.
3. Sony to announce an unlimited amount 30th anniversary release.
4. GTA6",4,1727700442.0,im waiting price drop disk drive incl sony announce unlimited amount th anniversary release gta,neutral
tonihurri,The visual boost on some games is impressive but I'm not dropping a grand on a console that is still likely to run GTA6 at 30 fps lol,8,1727645063.0,visual boost games impressive im dropping grand console still likely run gta fps lol,positive
custardbun01,It’s not just the price… I don’t get the point. This gen started with a whimper and seems to have not really taken off. It’s like PS4.5.,5,1727645106.0,price dont get point gen started whimper seems really taken like ps,negative
IfYouGotALonelyHeart,"Could’ve sold more if you made 30,000, 123,000, or even 300,000 of the 30th anniversary bundles. Choosing 12,300 was such a stupid number.",6,1727645140.0,couldve sold made even th anniversary bundles choosing stupid number,negative
pezdespo,"Are people really upvoting the Microsoft shill platform warring on Twitter?

The PS4 Pro also didn't sell out, it's a console directed towards enthusiasts 

If it did sell out you'd.just be insulting Sony for not allocating enough stock

Edit: yeah this post was 100% botted",18,1727644425.0,people really upvoting microsoft shill platform warring twitter ps pro also didnt sell console directed towards enthusiasts sell youdjust insulting sony allocating enough stock edit yeah post botted,negative
hamndv,The factories in China are ready to supply it worldwide,2,1727645713.0,factories china ready supply worldwide,positive
SkylineRSR,I’m waiting until they’re available at the military exchanges so I can get one tax free,2,1727646319.0,im waiting theyre available military exchanges get one tax free,positive
Objective-Aioli-1185,Might have to. My base PS5 is doing the jet engine hum now whenever I play Helldivers 2 and it brings back Vietnam flashbacks. I can already see it shutting off from overheating. Yes I clean it out regularly but it probably needs that thermal paste stuff I don't know where to get or even how to use.,2,1727648193.0,might base ps jet engine hum whenever play helldivers brings back vietnam flashbacks already see shutting overheating yes clean regularly probably needs thermal paste stuff dont know get even use,negative
ahs212,"Well that's one way to beat the scalpers, make something people don't want to buy.",2,1727648537.0,well thats one way beat scalpers make something people dont want buy,neutral
pjatl-natd,Or maybe Playstation made enough!,2,1727649145.0,maybe playstation made enough,neutral
Schraiber,"Ideally a thing is priced such that there's always just a few available. If it's sold out, that basically means it was too cheap. So depending on exactly how many are left, this may mean they nailed it, from a pricing standpoint. 

I'm not ""defending"" the price or anything, just saying that the market clearing price basically guarantees that there's some stock left over most of the time.",2,1727649292.0,ideally thing priced theres always available sold basically means cheap depending exactly many left may mean nailed pricing standpoint im defending price anything saying market clearing price basically guarantees theres stock left time,positive
DryFile9,"Judging the success of HW(or the appropriateness of a price point) based on the fact it did or didnt sell out is incredibly stupid. For all we know its moving exactly within expectations. It's so funny that supply chain constraints during the pandemic created this expectation that HW has to sell out.

I cant wait for these takes when the Switch 2 is also readily available a month after launch.",2,1727649661.0,judging success hwor appropriateness price point based fact didnt sell incredibly stupid know moving exactly within expectations funny supply chain constraints pandemic created expectation hw sell cant wait takes switch also readily available month launch,positive
Batking28,People are surprised supply can keep up with demand. This used to be normal. Covid shut down half of industry causing issues but that’s wasn’t the norm before and the backlog is basically clear.,2,1727650615.0,people surprised supply keep demand used normal covid shut half industry causing issues thats wasnt norm backlog basically clear,positive
huntsab2090,Aye because a lot of potential buyers were stopped from buying it due to the price. Me included.  I had my cc ready till the price was announced,2,1727651079.0,aye lot potential buyers stopped buying due price included cc ready till price announced,positive
RS38V,"If they made more of the ps5 pro 30th anniversary bundle I would have bought one, the fact it doesn’t also come with a disc drive is a major issue for me. Nearly all my games are physical.",2,1727653710.0,made ps pro th anniversary bundle would bought one fact doesnt also come disc drive major issue nearly games physical,positive
thinkthis,Or they just wanted to screw scalping by not capping preorders.,2,1727653856.0,wanted screw scalping capping preorders,neutral
Efficient_Tutor_5618,Didn't sell out because it released the same day as the anniversary items. ,2,1727655414.0,didnt sell released day anniversary items,neutral
Icecubemelter,I get the whole disc drive thing but I personally don’t remember the last time I popped in a disc. Especially as a PCMR member. At that price point you might as well spend a little more get a pc and buy the games on steam.,2,1727655607.0,get whole disc drive thing personally dont remember last time popped disc especially pcmr member price point might well spend little get pc buy games steam,positive
grilled_pc,"Still available in australia too.

Scalpers went for the 30th anniversary as it was rare and limited quantity. IMO this was easily going to be scalped as its limited quantity and some retailers especially in australia locked some of the 30th anniversary stuff behind huge rewards programs walls that only few had access too.

Scalpers who went for the regular PS5 Pro are going to eat shit real fast and i can't wait to see these PS5's reduced to a fraction over RRP or below when they realize they can't get it because they are still readily in stock lol.",2,1727656120.0,still available australia scalpers went th anniversary rare limited quantity imo easily going scalped limited quantity retailers especially australia locked th anniversary stuff behind huge rewards programs walls access scalpers went regular ps pro going eat shit real fast cant wait see pss reduced fraction rrp realize cant get still readily stock lol,positive
WorldEaterYoshi,"Mark my words, this is just Sony getting their highest possible profit margin from the people willing to pay their ridiculous asking price. The PS5 hardly ever goes on sale but I predict this one will be marked down $100 within the next year.",2,1727658713.0,mark words sony getting highest possible profit margin people willing pay ridiculous asking price ps hardly ever goes sale predict one marked within next year,negative
I_Hate_My_Cat_,Wish this could be said about the 30th anniversary edition 😔,2,1727659888.0,wish could said th anniversary edition,neutral
AussieWaffle,"Meanwhile in Australia, regular pro bundle $1200 sold out (830 usd), and the 30th anniversary bundle $1700 also sold out ($1175 usd)",2,1727662974.0,meanwhile australia regular pro bundle sold usd th anniversary bundle also sold usd,neutral
Virtual-Chicken-1031,"Yeah, I'm not about to spend $700 on a console. I'll just wait for the ps6. That price point is major bullshit",2,1727664638.0,yeah im spend console ill wait ps price point major bullshit,positive
None,[deleted],2,1727665118.0,deleted,neutral
zLedZeppelinz,No reason to buy one what so ever at that price,2,1727667131.0,reason buy one ever price,neutral
TheMikeSweeney306,This is actually good news that people are speaking with their wallets. I hope all the scalpers make no money and have a ton of overstock for their greed.,2,1727667171.0,actually good news people speaking wallets hope scalpers make money ton overstock greed,positive
ZeeGarage,The lack of physical drive is a bigger problem than the price imo,2,1727670114.0,lack physical drive bigger problem price imo,neutral
Otherwise-Remove4681,"Water is wet, more news at six.",2,1727670929.0,water wet news six,positive
Alukrad,"I just don't see the point of it. 

It really does nothing else than give you a slightly sharper image with a guaranteed 60fps. 

If I cared that much about that then I would've gotten myself a gaming computer...",2,1727671292.0,dont see point really nothing else give slightly sharper image guaranteed fps cared much wouldve gotten gaming computer,positive
