author,body,score,created_utc,preprocessed_body,sentiment
DRockDR,*plus tax most places,28,1727646308.0,plus tax places,positive
PhxRising29,Not everybody needs the disc drive.,10,1727646152.0,everybody needs disc drive,neutral
yan-booyan,"Thank you, i don't need a disk drive.",2,1727682301.0,thank dont need disk drive,neutral
Dramatic-Lychee-2089,I’m glad the disc drive is optional. Not interested in paying for it. Installing from disks take about 4 times as long as installing from gigabit internet.,2,1727647727.0,im glad disc drive optional interested paying installing disks take times long installing gigabit internet,positive
CrimsonGear80,not everyone needs the disk drive. there are those who have gone all digital.,1,1727647805.0,everyone needs disk drive gone digital,neutral
No_Share6895,"plus tax. and a stand if you dont want it sitting on its side(does it actually matter?). plus another $80 if you want online functionality. plus tax on at least the stand too. right about $1000 for just the console before games. like i get it niche stuff costs niche prices, and if people enjoy it good for them. but man... its so much.",1,1727707845.0,plus tax stand dont want sitting sidedoes actually matter plus another want online functionality plus tax least stand right console games like get niche stuff costs niche prices people enjoy good man much,positive
Mean_Combination_830,Well its 700 hundreds for me because I have gone digital long ago and PC has been digital only for ages now. I don't want to be forced to pay for something I'm not going to use but if do you want one you could order one with the pro.,1,1727652004.0,well hundreds gone digital long ago pc digital ages dont want forced pay something im going use want one could order one pro,negative
Bogzy,"No, you don't, most ppl haven't even seen a disc in over 10 years.",-5,1727646462.0,dont ppl havent even seen disc years,positive
IndecisiveTuna,I still feel like I haven’t gotten my money’s worth with my day 1 PS5.,22,1727649653.0,still feel like havent gotten moneys worth day ps,positive
No_Share6895,the no stand is so weird. like they are locking away the safest way of storign your console wtf,1,1727708086.0,stand weird like locking away safest way storign console wtf,negative
RelThanram,You have to purchase it separately.,1,1727708211.0,purchase separately,neutral
RelThanram,Because it’s a backwards compatible console and I have a lot of physical PS4 games.,1,1727775651.0,backwards compatible console lot physical ps games,neutral
ocbdare,"Sure but people like me who have the OG ps5 from launch, I am losing the disc drive. To get what I have now I need to spend another 100 bucks on top.",39,1727644405.0,sure people like og ps launch losing disc drive get need spend another bucks top,positive
shadowstripes,"> trade in the slims but carry over the drive

They'd be trading it in with a missing white panel that covers where the drive goes, which would be a little odd and definitely lower the value. I'm not actually sure if most gamestops would even accept it that way.",0,1727645020.0,trade slims carry drive theyd trading missing white panel covers drive goes would little odd definitely lower value im actually sure gamestops would even accept way,negative
ikillpaperpeople,So is your mom but people still want it,3,1727649566.0,mom people still want,neutral
Timerly,The disc drive has been sold out in EU ever since the diskless-announcement (price is currently around ~200$ where available).,0,1727646531.0,disc drive sold eu ever since disklessannouncement price currently around available,positive
IfYouGotALonelyHeart,$800 console.,12,1727645063.0,console,neutral
UnpopularThrow42,JuSt BuY tHE DiSk DriVE,11,1727645447.0,buy disk drive,neutral
GalexyPhoto,"Sorry, common sense is NOT welcome in here. Get out!",130,1727647033.0,sorry common sense welcome get,negative
WeBelieveIn4,"I just think there are some who think Sony can do no wrong. Even now the goalposts are changing to “no one thought it would sell out in the first place”, “the PS4 Pro didn’t sell out” etc etc.   

For the record I love my PS5 but Sony has made a lot of shitty decisions of late, from the live service push to the pricing strategy for PSVR 2 and the PS5 Pro.  

https://np.reddit.com/r/playstation/comments/1ferbsk/what_are_the_chances_that_ps5_pro_sells_out/  

https://np.reddit.com/r/playstation/comments/1fo2k5r/any_one_else_think_the_ps5_pro_wont_sell_out_of/",5,1727651056.0,think think sony wrong even goalposts changing one thought would sell first place ps pro didnt sell etc etc record love ps sony made lot shitty decisions late live service push pricing strategy psvr ps pro httpsnpredditcomrplaystationcommentsferbskwhatarethechancesthatpsprosellsout httpsnpredditcomrplaystationcommentsfokranyoneelsethinkthepsprowontselloutof,positive
Shigney,I'm sure I read some comments on this sub of people saying they didn't get one because it instantly sold out.,3,1727645632.0,im sure read comments sub people saying didnt get one instantly sold,positive
Outrageous_Water7976,Dude this reddit is full of the biggest idiots I've seen in a long time. The lack of knowledge or history is crazy. Also Tom Warren is a Microsoft guy this isn't even his beat to comment on.,1,1727676351.0,dude reddit full biggest idiots ive seen long time lack knowledge history crazy also tom warren microsoft guy isnt even beat comment,negative
Zaphod1620,"Because the entire reason for the low production count of the PS5 Pro was *because* of the low footprint of PS4 Pro owners among all PS4 owners. It's a niche, enthusiast product. Sony themselves did not expect it to sell out despite having a low volume. 

Why do people know this? Because some of us are into gaming and enjoy this stuff.

It's just a reaction on how some scalpers just hoard new products like this with no sense of the market.",7,1727656046.0,entire reason low production count ps pro low footprint ps pro owners among ps owners niche enthusiast product sony expect sell despite low volume people know us gaming enjoy stuff reaction scalpers hoard new products like sense market,positive
TitleVisual6666,8 years ago we had the internet and most of us were alive. The PS4 pro was so widely available at launch that Amazon even offered a $20 discount on it 2 weeks later on Black Friday.,3,1727667667.0,years ago internet us alive ps pro widely available launch amazon even offered discount weeks later black friday,positive
Pokedudesfm,is this a joke? people know that the pro didnt sell out pre orders because 8 years ago many of us were consdering getting one,1,1727658953.0,joke people know pro didnt sell pre orders years ago many us consdering getting one,positive
GarionOrb,The 30th anniversary edition sold out. If anyone said the regular Pro sold out then they're just making shit up.,49,1727645840.0,th anniversary edition sold anyone said regular pro sold theyre making shit,negative
Sub_Zero32,"The ironic thing here is that no one was saying the ps5 pro was selling out, they were saying the 30th anniversary edition was sold out. Which makes your last statement so hilarious",15,1727646635.0,ironic thing one saying ps pro selling saying th anniversary edition sold makes last statement hilarious,positive
-Gh0st96-,"And it still didn’t sell out, that’s his point",18,1727646001.0,still didnt sell thats point,neutral
sean_themighty,"Seriously. I paid $399 at launch, and that included RDR2!",2,1727686093.0,seriously paid launch included rdr,negative
TheHudIsUp,No it wasn't,-6,1727645969.0,wasnt,neutral
Sailing-Cyclist,"For the first time in my life I was actually quite keen on that 30th Edition console, even at its premium price. 

The fucker was sold out in 2 minutes. Like, what’s even the point Sony?",103,1727646534.0,first time life actually quite keen th edition console even premium price fucker sold minutes like whats even point sony,positive
OG_Builds,In Norway it costs $1000. Absolutely ridiculous…,2,1727685046.0,norway costs absolutely ridiculous,positive
stdfan,Or don’t limit it period. Just pre sell it and how many are ordered you make. Limited editions are poor for the consumer and only encourage scalpers.,24,1727666106.0,dont limit period pre sell many ordered make limited editions poor consumer encourage scalpers,positive
Weekly_Blackberry_11,No chance,0,1727723073.0,chance,neutral
tunafun,"Generally, it’s gonna be a third-party piece or sticker. Most of them are themed towards like a video game or solid colors or something.",2,1727707214.0,generally gonna thirdparty piece sticker themed towards like video game solid colors something,positive
tunafun,"I can’t do nostalgia sadly,",1,1727749529.0,cant nostalgia sadly,negative
ocbdare,"Yes. The PS4 Pro launched at the same price as the base ps4 launched 4 years before that. So if you were ok to pay launch ps4 price, ps4 pro was pretty much that but better hardware.

The PS5 pro is like double the price of a digital ps5 right now.",218,1727644322.0,yes ps pro launched price base ps launched years ok pay launch ps price ps pro pretty much better hardware ps pro like double price digital ps right,positive
Empty_Cube,"I agree with you. The PS4 Pro came out at a time where 4K was on the rise. It was also priced much more reasonably ($400, which was the same as the base PS4 launch price).

Meanwhile, PS5 Pro is launching at an $800 price point for anyone that has a physical library and there aren’t enough games that make it feel like a necessary purchase. PS4 versions are still being released for many games.

By the time there are enough games benefiting from the extra power of the PS5 Pro, the PS6 will be on the horizon, and I think most people would rather put money towards that than towards a console that will probably be replaced in ~3 years (if PS5 life cycle follows the standard 7 year span, the PS6 would launch in 2027).",39,1727644697.0,agree ps pro came time k rise also priced much reasonably base ps launch price meanwhile ps pro launching price point anyone physical library arent enough games make feel like necessary purchase ps versions still released many games time enough games benefiting extra power ps pro ps horizon think people would rather put money towards towards console probably replaced years ps life cycle follows standard year span ps would launch,positive
The_Macho_Madness,"Yeah, I bought a pro because it was the first console to take advantage of my fresh 4k tv.. now?",26,1727644380.0,yeah bought pro first console take advantage fresh k tv,positive
Funandgeeky,"When I decided to finally upgrade from my PS3 I went with the Pro because it made more sense. The 4K was the big selling point, along with the improvements over the base model. 

But I’m still using the same TV I’ve been using since the PS4 and already have a PS5. So while it’s a very good upgrade from the PS4 base model, the price tag is making some people falter. ",7,1727645303.0,decided finally upgrade ps went pro made sense k big selling point along improvements base model im still using tv ive using since ps already ps good upgrade ps base model price tag making people falter,negative
Dayzlikethis,"yea and you don't even get the stand for it, lol. fuck off sony.",15,1727645422.0,yea dont even get stand lol fuck sony,positive
joshua182,"Better price tag on the PS4 pro and also it was letting you enter the 4K market for games. PS5, you get 4K....again and pay a fat chunk more on top of the base PS5.",2,1727680351.0,better price tag ps pro also letting enter k market games ps get kagain pay fat chunk top base ps,positive
kasual7,"Yep also the PS4 Pro release 3 years into the PS4 life cycle, giving the PS5 Pro 1 year less comparatively to sell as much.",1,1727651847.0,yep also ps pro release years ps life cycle giving ps pro year less comparatively sell much,positive
Clarkey7163,"This pro is more compelling upgrade than the PS4 one was, however the price is the barrier this time around

I just don't know if the general gaming audience knows how important these AI image upscalers is going to be. PSSR will be a gamechanger 

Switch 2 reportedly has it and will be the first proper console mass market device to really take advantage of it, will be interesting to see it after that.",1,1727661843.0,pro compelling upgrade ps one however price barrier time around dont know general gaming audience knows important ai image upscalers going pssr gamechanger switch reportedly first proper console mass market device really take advantage interesting see,positive
PornCommentsAreWeird,"You are probably right, the one thing that may be a huge boost to the PS5 pro that the PS4 pro didnt have is a new GTA to show off what the hardware can do.  But who knows if that will be enough, or how much rockstar will even try to take advantage of it.  If im sony I am pushing for them to do that, and doing a pack in like they did with RDR2 and the ps4pro.",1,1727644996.0,probably right one thing may huge boost ps pro ps pro didnt new gta show hardware knows enough much rockstar even try take advantage im sony pushing pack like rdr pspro,positive
C0tilli0n,I dont know about general consensus but for me this pro is actually more compelling than previous pro. I didnt even own a ps4 pro yet I preordered this one.,1,1727645748.0,dont know general consensus pro actually compelling previous pro didnt even ps pro yet preordered one,positive
SwingLifeAway93,"Plenty of good examples as why we need a Pro. Much better than just a resolution change that the PS4 Pro had.

https://preview.redd.it/87ci9oj8ftrd1.jpeg?width=1320&format=pjpg&auto=webp&s=89546ed71f7a1b3a10d42fc5ff0fa0d972e77b18

PS5 to PS5 Pro for Dead Rising, for example.",-6,1727644892.0,plenty good examples need pro much better resolution change ps pro httpspreviewredditciojftrdjpegwidthformatpjpgautowebpsedfabadfcfffadeb ps ps pro dead rising example,positive
Dave10293847,"I don’t believe it’s less compelling but to each their own. I’ll be buying a pro but I see no reason to pre-order. My current PS5 works and I want to see some more DF footage. 

I think it’ll sell just fine. But there’s definitely no urgency.",0,1727654044.0,dont believe less compelling ill buying pro see reason preorder current ps works want see df footage think itll sell fine theres definitely urgency,positive
Toastradamus12,"The price might have been more alluring back then, but when I think back on my ps4 pro purchase I actually have to think hard what was so special about it. It was honestly kind of a waste of money for me personally. I didn’t have a 4K tv for most of its life and maybe it ran games a little better and maybe kept it from literally sounding like a jet engine when I popped in last of us 2 or ghost, but other than that it literally did fuck all. At least the ps5 pro gives you something tangible with combining fidelity and frame rate modes",0,1727699695.0,price might alluring back think back ps pro purchase actually think hard special honestly kind waste money personally didnt k tv life maybe ran games little better maybe kept literally sounding like jet engine popped last us ghost literally fuck least ps pro gives something tangible combining fidelity frame rate modes,positive
Lolcowabunga,"Feels the opposite imo, the PS4 pro only gave resolution and frame rate stabilization, the 5 pro actually gives more ",0,1727703170.0,feels opposite imo ps pro gave resolution frame rate stabilization pro actually gives,positive
AaronWestly,"The PS4 Pro was quite weak and made obsolete one year later when the Xbox One X arrived. What helped move units was the fact it was a PlayStation.

The PS5 Pro is much more powerful than the PS5, judging by the tests, and comes with a 2TB SSD, which is not the cheapest bit of hardware around. It's more expensive, but it's the only console-sized machine capable of going head on against current PCs, as Microsoft won't make a premium version of the Series X.

Both consoles have their advantages and disadvantages. The PS4 Pro's value was low because it wasn't powerful enough and the PS5 Pro isn't affordable enough.",0,1727715085.0,ps pro quite weak made obsolete one year later xbox one x arrived helped move units fact playstation ps pro much powerful ps judging tests comes tb ssd cheapest bit hardware around expensive consolesized machine capable going head current pcs microsoft wont make premium version series x consoles advantages disadvantages ps pros value low wasnt powerful enough ps pro isnt affordable enough,positive
RealityBitesFromOz,I agree the PS4 Pro was what the base needed to be.,0,1727729110.0,agree ps pro base needed,negative
NarrowBoxtop,"PS5 pro helps future proof you for PS6 cross gen games 

I don't want to play the next cyberpunk 2077 experience on the base console if I can't afford/get a ps6",-5,1727644980.0,ps pro helps future proof ps cross gen games dont want play next cyberpunk experience base console cant affordget ps,negative
Diastolic,"Regarding GTA6, as soon as people start seeing what they will get on the base PS5 vs Pro, then I think you are right that GTA6 will boost sales of the pro. I bought a PS4 pro specifically for red dead redemption 2 because of the 4K aspect (and we didn’t fully get that as they used checker board upscaling).",3,1727647657.0,regarding gta soon people start seeing get base ps vs pro think right gta boost sales pro bought ps pro specifically red dead redemption k aspect didnt fully get used checker board upscaling,negative
underdog_exploits,"Maybe if it runs at 4K60 on PS5 pro while base Ps5 limited to 4K30. I’d probably buy a ps5 pro if that was the case. But if base PS5 can run at 60 (even at a slightly lower resolution like 1800 or 1440), I wouldn’t upgrade. 

As of now, gt7 is the game I play the most. I would never use 8k60 over 4k120, so as of now, ps5 pro has nothing to offer me. 

I also use the blu ray player on the ps5 because the one with the Xbox series x is complete garbage, and I hate buffering and subpar audio with streaming movies, so still buy physical blu ray discs. 

I guess let’s hope for 4k60 on GTA6, or ps5 pro will be a complete bust.",1,1727814116.0,maybe runs k ps pro base ps limited k id probably buy ps pro case base ps run even slightly lower resolution like wouldnt upgrade gt game play would never use k k ps pro nothing offer also use blu ray player ps one xbox series x complete garbage hate buffering subpar audio streaming movies still buy physical blu ray discs guess lets hope k gta ps pro complete bust,negative
shootamcg,Best bet is to sell your old console on FBM or whatever your local marketplace is. I upgraded to PS5 from PS4 Pro for like $250 CAD but could have been less if I didn’t give that guy a killer deal.,3,1727652262.0,best bet sell old console fbm whatever local marketplace upgraded ps ps pro like cad could less didnt give guy killer deal,positive
TheButteredBiscuit,"GameStop doesn’t even have games day 1 if you don’t preorder. 

I really want to bypass them entirely, but I’m in the same boat as you, trying to trade my console. Just wish literally any other place had trade ins, because I trust GS about as far as I can throw it.",5,1727648428.0,gamestop doesnt even games day dont preorder really want bypass entirely im boat trying trade console wish literally place trade ins trust gs far throw,positive
GarionOrb,"You probably will. For the PS4 Pro, I just walked into Best Buy and got one on launch day as well.",0,1727645907.0,probably ps pro walked best buy got one launch day well,positive
shootamcg,"Can’t speak for you, but I really liked the PS4 Pro. Most of the big games either had a performance mode or ran at a higher resolution. I would have been excited for PS5 Pro if it wasn’t for the price. 

I don’t know what GTA 6’s PS5 Pro support will be but it almost certainly will still be 30 fps.",1,1727666820.0,cant speak really liked ps pro big games either performance mode ran higher resolution would excited ps pro wasnt price dont know gta ps pro support almost certainly still fps,positive
CRAYONSEED,Insanity Pro,2,1727814184.0,insanity pro,neutral
josh_bourne,"Well, I think they know very well about this.  

For now on people who never had a ps5 will, maybe, buy the pro, but all the ones sold until now were for ""diehards""",2,1727656018.0,well think know well people never ps maybe buy pro ones sold diehards,positive
062d,"Same, I have a top end PC and the difference between the same game on ps5 and PC top everything settings is not big enough for me to care much I still mostly buy on PlayStation if it's multiplat despite it being ""lower graphics"". The ps5 pro is nowhere as big an upgrade so I don't really understand the draw besides FOMO.",3,1727697441.0,top end pc difference game ps pc top everything settings big enough care much still mostly buy playstation multiplat despite lower graphics ps pro nowhere big upgrade dont really understand draw besides fomo,positive
FalscherKim,What a dumb comment,3,1727693937.0,dumb comment,negative
TradeShoes,And resellers,-4,1727647387.0,resellers,neutral
Xplay3r_,"Its also for 1k USD before tax, lmao",2,1727707332.0,also k usd tax lmao,positive
Troyal1,I bet it’s also Quieter than pro,3,1727670731.0,bet also quieter pro,neutral
CoconutPedialyte,$410 for my PS5 and $300 for my series s was crazy good,1,1727678122.0,ps series crazy good,positive
MRintheKEYS,"Nah I’ll hold off til they actually have them in store.  I’m not too concerned about resell value. 

Shit I’m still stuck eating my launch PSVR2 as the value of it bottomed out.",1,1727684760.0,nah ill hold til actually store im concerned resell value shit im still stuck eating launch psvr value bottomed,negative
AaronWestly,"Killzone Shadowfall, Knack and Resogun, lol.",1,1727715386.0,killzone shadowfall knack resogun lol,positive
acbadger54,"It was an incredibly consumer-friendly choice at launch but, it didn't take long for the issues to start popping up and within only a few years, it's basically held the Generation back


It was an incredibly anti dev friendly choice",2,1727743065.0,incredibly consumerfriendly choice launch didnt take long issues start popping within years basically held generation back incredibly anti dev friendly choice,positive
Lyelinn,"\~831 usd, still better than us europoors sadly",3,1727705988.0,usd still better us europoors sadly,neutral
gamerjerome,"There is some psychology behind all this. I think some people really just want to be part of the conversation when something new comes out. If they can't they get mad and point blame. They really hate being left out. Especially in the day of social media.

Is the price high? Yes. Is it too high for what you get, I don't think so. I think it's a deal for what it can do. Would people have liked it better if they had a disk version? Yes. Is Sony not making a disk version and inconveniencing people to have to buy it separately to perpetuate digital only, probably. That's the only thing to really be mad at.",0,1727670523.0,psychology behind think people really want part conversation something new comes cant get mad point blame really hate left especially day social media price high yes high get dont think think deal would people liked better disk version yes sony making disk version inconveniencing people buy separately perpetuate digital probably thats thing really mad,negative
VariousBread3730,The extra space is +$100 and the upgrades are also worth like $100 *considering the function of consoles*,1,1727671286.0,extra space upgrades also worth like considering function consoles,positive
yorjsns,"Blame your shit EU regulations, not Sony.",1,1727692931.0,blame shit eu regulations sony,negative
Jamiemufu,Enthusiasts are running 120hz tvs. The pro is a perfect upgrade for enthusiasts. Stop being salty you can’t afford the luxury to have one.,5,1727648528.0,enthusiasts running hz tvs pro perfect upgrade enthusiasts stop salty cant afford luxury one,positive
