author,body,score,created_utc,preprocessed_body,sentiment
Radulno,"No they exist because of artificial scarcity, like for sneakers or limited edition stuff or the one caused by stuff like a huge pandemic (which isn't the case now). 

Products being on stock at normal stores isn't an anomaly even for successful products, it's just the sign of a good logisitic and production chain which most companies have. That scalpers could exploit it at some time was an anomaly and now they're trying to reproduce it by causing themselves the shortages lol",2,1727683265.0,exist artificial scarcity like sneakers limited edition stuff one caused stuff like huge pandemic isnt case products stock normal stores isnt anomaly even successful products sign good logisitic production chain companies scalpers could exploit time anomaly theyre trying reproduce causing shortages lol,positive
whoisdatmaskedman,"You're not wrong. I'm not a scalper, but one time when I was like 16 I was at an Electronics Boutique (now GameStop...) paying for my preorder of GoldenEye 007 for N64. As I was leaving the store, a man and his son walk in and the kid goes *""That's the game I wanted...""* and he turns to the clerk and the clerk tells them they don't have anymore copies and the dude chases me down and offers me $250 for my copy. Now, the man could have done what I ended up doing, which was wait two more weeks and get another copy, but he buckled to his kids demand and I made $170 profit, which I used to buy used PS1 and a copy of FFVII.",2,1727701798.0,youre wrong im scalper one time like electronics boutique gamestop paying preorder goldeneye n leaving store man son walk kid goes thats game wanted turns clerk clerk tells dont anymore copies dude chases offers copy man could done ended wait two weeks get another copy buckled kids demand made profit used buy used ps copy ffvii,positive
Israelcaneatshit,Scalpers exist because it's not illegal... why you shifting blame on the consumer?,5,1727654198.0,scalpers exist illegal shifting blame consumer,positive
FingerGoo,No. Lmao its grown adults with no impulse control and too much money.,2,1727666625.0,lmao grown adults impulse control much money,negative
YoungRichBastard26s,A guy I knew who worked at my job was selling ps5s for 700-1k and folks was buying them here in Mississippi,1,1727679679.0,guy knew worked job selling pss k folks buying mississippi,neutral
johnzischeme,"I always get a new system at launch, play through a few titles, then sell it at Christmas time for cost. I try to find a parent I can help out a little bit. 

Then I buy again when there’s more titles or availability. It’s a pretty good system I’ve used it for years.",1,1727698491.0,always get new system launch play titles sell christmas time cost try find parent help little bit buy theres titles availability pretty good system ive used years,positive
huzernayme,I did a bit of scalping and most buyers were adults who intended to use it. I would always ask so I knew how to offer accessories. People would pay anything for anything just to have it.,1,1727717852.0,bit scalping buyers adults intended use would always ask knew offer accessories people would pay anything anything,positive
JakeSteeleIII,And orphanages,1,1727720640.0,orphanages,neutral
Islander_84,Do you have kids?,-3,1727648789.0,kids,neutral
Interesting-Mode-694,"That first sentence bro, the accuracy",0,1727656086.0,first sentence bro accuracy,positive
-Unpredictable-,It could be as well. i also wouldn’t be surprised about some people really being idiots though.,1,1727649544.0,could well also wouldnt surprised people really idiots though,negative
devenbat,3rd parties sell stuff on Amazon which is like the default shopping app for many. There's plenty of people whose first place will be look on Amazon and see the console for msrp rather than go through a site they might not even know exists,1,1727647413.0,rd parties sell stuff amazon like default shopping app many theres plenty people whose first place look amazon see console msrp rather go site might even know exists,positive
Dependent-Zebra-4357,"Some clown trying to sell it for $12,300, rofl.",8,1727693750.0,clown trying sell rofl,positive
indyK1ng,By jacking up the price.,-15,1727647088.0,jacking price,neutral
CyberMoose24,"That and all of us now realize that 1) this generation has been filled with way more cross-gen and remastered games than PS4 was, and 2) the overwhelming majority of PS5 console exclusives are coming to PC.",7,1727652699.0,us realize generation filled way crossgen remastered games ps overwhelming majority ps console exclusives coming pc,positive
Atomic_Horseshoe,"While they aren’t going to win, they don’t really stand to lose anything either. They took a risk-free gamble that demand would outstrip supply between now and Christmas. All they’re out are the minutes they took to order the console, place it for sale, and then return the console/cancel the preorder. ",1,1727655932.0,arent going win dont really stand lose anything either took riskfree gamble demand would outstrip supply christmas theyre minutes took order console place sale return consolecancel preorder,positive
BushMonsterInc,"On top of that, if you have PS5 already, you can wait for local retailer to restock Pro",1,1727674638.0,top ps already wait local retailer restock pro,positive
AlexZyxyhjxba,Im still rocking my iPhone 7 bro.,2,1727768297.0,im still rocking iphone bro,neutral
VagrantandRoninJin,So why not pay someone to customize your phone? Like there are options where you don't have to give apple even more money for a COLOR CHANGE.,1,1727696904.0,pay someone customize phone like options dont give apple even money color change,positive
usingallthespaceican,"Ah, wrong edition, mb",2,1727684609.0,ah wrong edition mb,negative
Dependent-Zebra-4357,"Based on an eBay image someone posted above, scalpers are trying for up to 10x the price of the 30th anniversary Pro. One listing is for $12,300!",1,1727694138.0,based ebay image someone posted scalpers trying x price th anniversary pro one listing,neutral
ChiefObliv,"If Sony really wants consumers to go digital, they should drop the price of digital games by $5 so it's cheaper than the physical copy.  I love physically owning games, but I'm also a cheap ass and would probably try to save the $5",33,1727701253.0,sony really wants consumers go digital drop price digital games cheaper physical copy love physically owning games im also cheap ass would probably try save,positive
yorjsns,"Sony would prefer to lose physical sales if digital sales increase by like 15% more than they are right now. 70$ but most of it goes
1) cost to Make the game
2) cost to produce the physical versions and distribute them
3) the cost of paying retailers for selling the discs",2,1727685745.0,sony would prefer lose physical sales digital sales increase like right goes cost make game cost produce physical versions distribute cost paying retailers selling discs,positive
fatherofraptors,"Sure but one can argue that physical sales are down BECAUSE digital is heavily incentivized by Sony/Xbox/Nintendo, not despite of. 


I can't imagine not having a disc drive. Literally bought Astro Bot right here on Reddit for $40 last week, already played and let a friend borrow it, then I'll probably just sell it again for the exact same price I got it for. 


The value proposition is absolutely insane on physical media compared to barely owning whatever you buy as digital.",4,1727700956.0,sure one argue physical sales digital heavily incentivized sonyxboxnintendo despite cant imagine disc drive literally bought astro bot right reddit last week already played let friend borrow ill probably sell exact price got value proposition absolutely insane physical media compared barely owning whatever buy digital,negative
Entropic_Alloy,The Insomniac leak showed that disc sales still massively outperformed digital sales.,2,1727834680.0,insomniac leak showed disc sales still massively outperformed digital sales,neutral
pvlrss,"What do you need a stand for? Isn’t it supposed to stand on its own? Sorry for the silly question, I never owned a PS.",-1,1727674840.0,need stand isnt supposed stand sorry silly question never owned ps,negative
adsmeister,"Exactly, the price is fairly reasonable for what you’re getting.",1,1727738383.0,exactly price fairly reasonable youre getting,positive
Rashlyn1284,Just gotta make sure you have the poop knife out of the way or it'll scratch them.,34,1727647358.0,gotta make sure poop knife way itll scratch,positive
catsrcool89,I haven't heeded to clean a disk since ps3.,16,1727645789.0,havent heeded clean disk since ps,positive
Andrew_Waples,I'm sorry what?,1,1727649032.0,im sorry,negative
usereddit,This was very common back in the day where I grew up - we did this all the time in middle school . In fact this came up in conversation the other day with a group of friends about how we used to do that,1,1727689091.0,common back day grew time middle school fact came conversation day group friends used,negative
BusCrashBoy,"That is the most insane thing I have ever heard, and I spent all evening on r/relationship_advice",1,1727737813.0,insane thing ever heard spent evening rrelationshipadvice,negative
Logical-Bit-746,Is that how you get the black discs?,1,1727652660.0,get black discs,negative
Mean_Combination_830,PC games are so horribly optimised these days you need a 40 series card to get way better performance and resolution than the far better optimised PS5 games.,1,1727651564.0,pc games horribly optimised days need series card get way better performance resolution far better optimised ps games,positive
C_Drew2,"They're not giving up on disc games when physical is over 50% of the sales for many of their first-party games.

Now we could be talking about a discless PS7 for sure, but that's too long to even consider at this point.",39,1727647240.0,theyre giving disc games physical sales many firstparty games could talking discless ps sure thats long even consider point,positive
ironman288,My guess is the disc drive will only be an optional accessory for the ps6 and they will never offer a disc drive equipped console again.,4,1727654733.0,guess disc drive optional accessory ps never offer disc drive equipped console,neutral
ZB314,"No, I fully expect it won’t. But I still want to be able to play new games, so I will deal with it if it comes to that. I just don’t want to support not having built-in disc support just for minimal performance enhancements.",8,1727646681.0,fully expect wont still want able play new games deal comes dont want support builtin disc support minimal performance enhancements,positive
blackicebaby,PS6 will be streaming only from the cloud. No more SSD nor concern over 500gb call of duty game install.,0,1727653892.0,ps streaming cloud ssd concern gb call duty game install,negative
blueish55,at the rate things are going the ps6 wont even be worth it lol,-1,1727648265.0,rate things going ps wont even worth lol,positive
LuckyTheBear,"Yo same. I had to sell one of my consoles last year and I chose the PS5 over the Series X because gamepass is cheaper than $70 every time I want a new game. I figured Sony will cook and when I'm ready to buy again, I'll get the PS5 Pro (hypothetical at thr time) and go ham.


Now what?

I guess I'm getting a cheap digital base model on market place.",-1,1727647414.0,yo sell one consoles last year chose ps series x gamepass cheaper every time want new game figured sony cook im ready buy ill get ps pro hypothetical thr time go ham guess im getting cheap digital base model market place,negative
ZB314,"Yes, but for a product that is a full generational leap and plays games exclusive to it. I will be upset by the lack of the drive then as well, but the benefits will hopefully outweigh the cons to justify my purchase.",2,1727668330.0,yes product full generational leap plays games exclusive upset lack drive well benefits hopefully outweigh cons justify purchase,positive
ZB314,Already addressed this question,1,1727662182.0,already addressed question,neutral
ZB314,Did you mean PS5 Slim or something? Because my PS5 definitely has a built-in drive.,2,1727658943.0,mean ps slim something ps definitely builtin drive,negative
Alternative-Donut779,Demon souls on PS5 was the last one I bought and I don’t remember if it came with the console or if I just bought it at the same time. Still one of my favorite ps5 games that people rarely mention when talking about exclusives for some reason.,1,1727695737.0,demon souls ps last one bought dont remember came console bought time still one favorite ps games people rarely mention talking exclusives reason,positive
underdog_exploits,"You don’t own any games digitally. You’ve only agreed to rent them. 

Ubisoft recently caught flak for delisting the Crew 1 from users libraries. Publishers with half a brain typically don’t do brain-dead crap like Ubisoft, but I wouldn’t be surprised to see more of this type of BS in the future for digital games.",1,1727812480.0,dont games digitally youve agreed rent ubisoft recently caught flak delisting crew users libraries publishers half brain typically dont braindead crap like ubisoft wouldnt surprised see type bs future digital games,positive
PirateNinjaa,"Swapping discs when you want to switch games is barbaric, just like changing the volume on the tv before remote controls.",2,1727835229.0,swapping discs want switch games barbaric like changing volume tv remote controls,negative
Mysterious_Sea1489,"Yes but not everyone needs a disc drive. The majority of people don’t use it. And yes it benefits Sony if you don’t have one. But also why sell it to people who don’t use it?

Also you only need the stand if you want it vertical. It sits horizontally just fine on the included base. I don’t think people understand this.",-3,1727651426.0,yes everyone needs disc drive majority people dont use yes benefits sony dont one also sell people dont use also need stand want vertical sits horizontally fine included base dont think people understand,negative
yan-booyan,People be jumping hoops to try to justify why they are not buying something.,0,1727682039.0,people jumping hoops try justify buying something,neutral
ItsAmerico,">They’re not asking for a different version, they’re asking for a bundle

That’s literally a different version. Sony now has to create two unique bundles to sell. One with the hard drive and one without. Stores would now have to stock two different versions.",1,1727648032.0,theyre asking different version theyre asking bundle thats literally different version sony create two unique bundles sell one hard drive one without stores would stock two different versions,positive
ItsAmerico,"No it isn’t. The point of the pro is that it’s the most powerful. Disc drive as fuck all to do with that. With or without it, both versions are identical in power.

Also the base Ps5 omitted that too. There’s literally a digital only Ps5.

Let’s not forget the current PS5s also come with and without a hard drive. And they have for awhile. Something that if you already bought WORKS with the Ps5 pro.",1,1727651582.0,isnt point pro powerful disc drive fuck without versions identical power also base ps omitted theres literally digital ps lets forget current pss also come without hard drive awhile something already bought works ps pro,negative
siggystabs,"My “base” PS5 doesn’t have a disc drive. That was extra.

Which I didn’t get, because it’s literally just for people who have shitty internet. You can’t play games off disc, they still have to be installed.

Genuinely I feel like the vast majority of people complaining about this were never gonna get one anyway. The Xbox Series X was heralded for its disc drive, oh wait no… *for Game Pass*. The only people this really affects are video game historians/collectors. And for you; buy the disc drive add-on. Easy.",0,1727662629.0,base ps doesnt disc drive extra didnt get literally people shitty internet cant play games disc still installed genuinely feel like vast majority people complaining never gonna get one anyway xbox series x heralded disc drive oh wait game pass people really affects video game historianscollectors buy disc drive addon easy,negative
BorgDrone,"> The whole point of the pro is that it is the definitive ""best"" version of the ps5

Exactly why it shouldn’t have a disc drive. It’s the faster, most high-tech console on the market. It makes no sense to include a piece of 80’s technology for storing games when better options are readily available. 

Disc games are clunky, having to swap discs is annoying, it produces a whole bunch of unnecessary plastic waste and installing games from disc is much slower than simply downloading them. 

If there is anything the PS5 Pro is missing it’s not a disc drive, it’s a 10 gigabit ethernet port.",-1,1727652196.0,whole point pro definitive best version ps exactly shouldnt disc drive faster hightech console market makes sense include piece technology storing games better options readily available disc games clunky swap discs annoying produces whole bunch unnecessary plastic waste installing games disc much slower simply downloading anything ps pro missing disc drive gigabit ethernet port,positive
ItsAmerico,You seriously think if the hard drive came included it would be the same price lol?,0,1727651220.0,seriously think hard drive came included would price lol,positive
HeavyVoid8,Which is why I'm saying there's no point in upgrading to get 20fps more,-8,1727646139.0,im saying theres point upgrading get fps,positive
grilled_pc,Oh I do use other store fronts. I use Green Man Gaming a lot of the time when buying new games. Often its $10 - $15 less than steam even on sale.,1,1727661656.0,oh use store fronts use green man gaming lot time buying new games often less steam even sale,negative
grilled_pc,I feel like this is one of the bigger sentiments here. Why stick with console if we are being forced in to a digital future? Can do that better on PC which has been digital only for almost 2 decades now.,0,1727661723.0,feel like one bigger sentiments stick console forced digital future better pc digital almost decades,positive
adsmeister,It’s just people who are tempted by it trying to justify to themself why they’re not getting it.,1,1727738807.0,people tempted trying justify themself theyre getting,neutral
Ironman1690,People always say that and it’s just not true. They have to add stipulations like buying games secondhand or buying them and then selling them later to make their argument work. Digital games are on sale literally all the time no different than physical. I haven’t paid full price for a game since the PS5 released and I only buy digital.,5,1727656647.0,people always say true add stipulations like buying games secondhand buying selling later make argument work digital games sale literally time different physical havent paid full price game since ps released buy digital,negative
Dramatic-Lychee-2089,"Depends where you live. There is no used games store where I live. We do have some stores selling new titles at a discount tho, but no stores with a really wide selection of games outside of top 20 / news. I’m a bit mixed on second hand games. I want the developer to get money for every person that plays the game, so they can further invest in future titles. If you have more people playing on the same license it’s taking away from that",0,1727677951.0,depends live used games store live stores selling new titles discount tho stores really wide selection games outside top news im bit mixed second hand games want developer get money every person plays game invest future titles people playing license taking away,positive
IndecisiveTuna,Right. Maybe that’s why this cycle feels weaker than previous ones. I definitely didn’t anticipate a HZD remake. Seems completely unwarranted when there are so many older IPs from PS3 and older that could actually use it.,12,1727650397.0,right maybe thats cycle feels weaker previous ones definitely didnt anticipate hzd remake seems completely unwarranted many older ips ps older could actually use,positive
No_Share6895,heck the remakes/remasters from last gen are insane. i can get a FREE next gen up grade a la the witcher 3 but thats it. other than that we can play these games on the ps5 still.,1,1727708141.0,heck remakesremasters last gen insane get free next gen grade la witcher thats play games ps still,negative
No_Share6895,for the most part they can. the gap between the ps4 and ps5 is barely 60% of that between the ps3 and ps4. add into the fact that ps5 tries to get 4 or so times the pixels and the ps4 gpu can run most of the games at sub 1080p. ezpz.,1,1727708540.0,part gap ps ps barely ps ps add fact ps tries get times pixels ps gpu run games sub p ezpz,positive
tsukiko,"It only has to be online to authenticate and pair the drive to the console a *single time*. After that is done once, the console can't be offline indefinitely. It doesn't have to be online ever again after a successful pairing. I don't think you even need a PSN subscription to pair the drive, but IDK if you *just* need to have internet access or if you have to actually register it to an account? I have an OG PS5 with a non-detachable drive so I'm not sure about the exact particulars.

It's not ideal but I don't think that's the main issue. I find it worrying that there isn't even a convenient way to bundle the disc drive at the same when ordering—even if the components still came in completely separate boxes. If a future PlayStation console didn't support physical games that contain code for that hardware, I think I would skip the console entirely.

I usually buy more than one console, and have had every generation of PlayStation since the first and a PS4 Pro also. Physical games that you can actually *own copies* of is a huge reason why I still invest in the PS ecosystem. If a future generation goes digital-only then I might as well just buy on PC at that point.",4,1727645915.0,online authenticate pair drive console single time done console cant offline indefinitely doesnt online ever successful pairing dont think even need psn subscription pair drive idk need internet access actually register account og ps nondetachable drive im sure exact particulars ideal dont think thats main issue find worrying isnt even convenient way bundle disc drive orderingeven components still came completely separate boxes future playstation console didnt support physical games contain code hardware think would skip console entirely usually buy one console every generation playstation since first ps pro also physical games actually copies huge reason still invest ps ecosystem future generation goes digitalonly might well buy pc point,positive
UnpopularThrow42,"You’re not wrong about inflation, but since wages haven’t necessarily kept up at the same rate it still will be a hefty sale for some",4,1727645418.0,youre wrong inflation since wages havent necessarily kept rate still hefty sale,positive
kobrakai11,"You count the inflation in the cost of the components already. You don't really know the cost to produce, because you have no idea what prices Sony got for the parts. Look at it this way. The upgrade from ps4 pro to ps5 cost me less than 200€ 3 years ago. Now, this much smaller upgrade would cost me more than 500€. That's an insane difference and it's just not worth it for nearly anyone. They priced the pro version way too high.",2,1727646117.0,count inflation cost components already dont really know cost produce idea prices sony got parts look way upgrade ps pro ps cost less years ago much smaller upgrade would cost thats insane difference worth nearly anyone priced pro version way high,negative
Friendly_Top6561,"It’s not only inflation, the cost for semiconductors does not get cheaper for each node anymore and this uses quite a lot of silicon.

PS5 pro silicon is much more expensive than regular PS5 silicon, they probably had to improve the cooling as well.",-1,1727645199.0,inflation cost semiconductors get cheaper node anymore uses quite lot silicon ps pro silicon much expensive regular ps silicon probably improve cooling well,neutral
ocbdare,"Yes. It's interesting how Sony are testing how much they can push this. PS5 Pro is £700 + £100 disc drive, that's £800, which is $1070 in USD for a console. It's quite steep. I've never seen a console anywhere this expensive from PS/Xbox/Nintendo.",1,1727646329.0,yes interesting sony testing much push ps pro disc drive thats usd console quite steep ive never seen console anywhere expensive psxboxnintendo,positive
ocbdare,"Not on a console where you are locked to one digital store. I am happy not to use physical games on my PC but I have a million stores that sell digital games.

On a PlayStation, it's pure monopoly when it comes to digital games. Give Sony 2-3 more years and games will cost $80.",1,1727647272.0,console locked one digital store happy use physical games pc million stores sell digital games playstation pure monopoly comes digital games give sony years games cost,positive
IfYouGotALonelyHeart,How much does it cost when you add a disc drive?,1,1727648400.0,much cost add disc drive,positive
lettucelover223,Yes..? That's what he just said.,20,1727648725.0,yes thats said,neutral
GalexyPhoto,What...uh... Whatcha talkin about?,11,1727649231.0,whatuh whatcha talkin,neutral
Abba_Fiskbullar,"I'm guessing that the majority of these consoles don't actually exist yet, and will be built based on order volume.",0,1727650450.0,im guessing majority consoles dont actually exist yet built based order volume,neutral
Sub_Zero32,Link it. Everyone was talking about the anniversary bundle,-1,1727647110.0,link everyone talking anniversary bundle,neutral
